{
  "version": "2026-09-01 12:00",
  "lastUpdated": "2026-09-01 12:00（示例数据）",

  "CATS": {
    "checkin":  { "label": "报到 / 注册", "color": "#5b6472" },
    "edu":      { "label": "入学教育",     "color": "#c07a2c" },
    "required": { "label": "必修课程",     "color": "#8c1d2b" },
    "elective": { "label": "选修课程",     "color": "#b8860b" },
    "ceremony": { "label": "典礼活动",     "color": "#a8842a" },
    "misc":     { "label": "其他安排",     "color": "#6b7280", "hideInLegend": true }
  },

  "PINYIN": {
    "张三": "zhangsan",
    "李四": "lisi",
    "王五": "wangwu",
    "赵六": "zhaoliu"
  },

  "DAYS": [
    {
      "key": "0901", "start": "2026-09-01", "end": "2026-09-01",
      "d1": "09.01", "d2": "周二", "big": "9 月 1 日", "week": "周二",
      "note": "以下全部为示例数据，用于演示框架效果，与任何真实课程安排无关。",
      "events": [
        {
          "time": "09:00–11:00", "cat": "checkin",
          "title": "新生报到注册",
          "sub": "凭录取通知书办理",
          "cls": "2026 级示例班",
          "where": "教学楼 A 座大厅",
          "note": "请提前准备好一寸照片两张"
        },
        {
          "time": "14:00–16:00", "cat": "edu",
          "title": "入学教育：学院介绍与学业规划",
          "who": "张三",
          "cls": "2026 级示例班",
          "where": "教学楼 A101"
        },
        {
          "time": "19:00–20:30", "cat": "misc",
          "title": "班级破冰活动",
          "where": "学生活动中心",
          "noAlarm": true
        }
      ]
    },
    {
      "key": "0902", "start": "2026-09-02", "end": "2026-09-02",
      "d1": "09.02", "d2": "周三", "big": "9 月 2 日", "week": "周三",
      "events": [
        {
          "time": "09:00–12:30", "cat": "required",
          "title": "决策分析与博弈论",
          "sub": "必修 2 学分 · 第 1 讲",
          "who": "李四",
          "cls": "2026 级示例班",
          "nature": "必修", "credit": "2",
          "where": "教学楼 A101",
          "link": { "label": "课前阅读材料（示例外链）", "url": "https://example.com/reading/1" }
        },
        {
          "time": "14:00–17:30", "cat": "required",
          "title": "商务谈判与沟通",
          "sub": "必修 2 学分 · 第 1 讲",
          "who": "王五",
          "cls": "2026 级示例班",
          "nature": "必修", "credit": "2",
          "where": "教学楼 A102"
        }
      ]
    },
    {
      "key": "0903", "start": "2026-09-03", "end": "2026-09-03",
      "d1": "09.03", "d2": "周四", "big": "9 月 3 日", "week": "周四",
      "events": [
        {
          "time": "09:00–12:30", "cat": "required",
          "title": "公司财务",
          "sub": "必修 3 学分 · 第 1 讲",
          "who": "赵六",
          "cls": "2026 级示例班",
          "nature": "必修", "credit": "3",
          "where": "教学楼 A101",
          "note": "教室临时调整：由 A103 改为 A101"
        },
        {
          "time": "14:00–17:30", "cat": "elective",
          "title": "数据分析基础",
          "sub": "选修 2 学分 · 第 1 讲",
          "who": "张三",
          "cls": "2026 级示例班（选修）",
          "nature": "选修", "credit": "2",
          "where": "机房 B201"
        }
      ]
    },
    {
      "key": "0904", "start": "2026-09-04", "end": "2026-09-04",
      "d1": "09.04", "d2": "周五", "big": "9 月 4 日", "week": "周五",
      "events": [
        {
          "time": "09:30–11:30", "cat": "ceremony",
          "title": "开学典礼",
          "sub": "全体新生",
          "cls": "2026 级全体新生",
          "where": "大礼堂"
        },
        {
          "time": "14:00–17:30", "cat": "required",
          "title": "战略管理",
          "sub": "必修 2 学分 · 第 1 讲",
          "who": "李四",
          "cls": "2026 级示例班",
          "nature": "必修", "credit": "2",
          "where": "教学楼 A101"
        }
      ]
    },
    {
      "key": "w2", "start": "2026-09-07", "end": "2026-09-11",
      "d1": "09.07", "d2": "第 2 周", "big": "9 月 7 日 — 9 月 11 日", "week": "第 2 周",
      "note": "示例：连续多天可以合并成一个日期块。",
      "events": [
        {
          "time": "09:00–12:30", "cat": "required",
          "title": "运营管理",
          "sub": "必修 2 学分 · 集中授课",
          "who": "王五",
          "cls": "2026 级示例班",
          "nature": "必修", "credit": "2",
          "where": "教学楼 A101",
          "endDate": "2026-09-11"
        },
        {
          "time": "全天", "cat": "misc",
          "title": "小组作业提交周",
          "note": "本周内提交即可",
          "endDate": "2026-09-11",
          "noAlarm": true
        }
      ]
    }
  ],

  "TEACHERS": {
    "张三": {
      "title": "示例职称",
      "dept": "示例学院",
      "focus": "示例研究方向",
      "bio": "这是一条示例简介，用于演示老师弹窗的排版效果。真实使用时请确认已获得当事人授权，或者干脆把 features.teacherProfiles 关掉。",
      "source": "https://example.com",
      "sourceLabel": "示例来源",
      "confidence": "低"
    }
  },

  "QA_ITEMS": [
    {
      "tag": "重要提醒",
      "date": "关于本页数据",
      "title": "这份课表是示例数据吗？",
      "body": "是。仓库自带的 data/schedule.example.json 全部是虚构内容，课程名、老师名、教室都不对应任何真实安排，仅用于演示框架效果。请把它替换成你自己的课表。"
    },
    {
      "tag": "使用说明",
      "date": "关于更新频率",
      "title": "订阅日历后为什么没有立刻更新？",
      "body": "订阅类日历不是实时同步的，各平台按自己的节奏拉取，通常几小时到一天。苹果日历可以手动下拉刷新，也可以在日历简介里把自动刷新调成每小时。"
    }
  ],

  "CHANGELOG": [
    {
      "date": "2026-09-01",
      "source": "示例",
      "changes": [
        { "type": "add", "text": "示例：新增 9 月 4 日开学典礼" },
        { "type": "update", "text": "示例：9 月 3 日公司财务教室由 A103 改为 A101" }
      ]
    }
  ]
}
